{
  "artifact_id": "V0_OSAP_GATE3_CLUSTER_B_WP4_DUAL_BACKEND_PROOF_MANIFEST",
  "baseline": "c90041d3da5b680b574b910de50d8769d32fbfa9",
  "claim_boundary": [
    "No proof-term identity claim.",
    "No Lean-kernel/Coq-kernel equivalence claim.",
    "No unrestricted semantic equivalence claim.",
    "T158 and T160 remain conditional."
  ],
  "date": "2026-07-23",
  "theorem_count": 6,
  "theorems": [
    {
      "canonical_name": "strong_dle_characterization",
      "claim_class": "THEOREM_TARGET",
      "conditional": false,
      "coq": {
        "source": "coq/theories/ClusterB.v",
        "status": "PROVED",
        "symbol": "T157_strong_dle_characterization"
      },
      "coq_symbol": "T157_strong_dle_characterization",
      "formal_signature": "StrongDLE(R,c,r,x,tr) iff WasLive(R,c,r,x) and NoLive(R,c,r,x) and DLETransitionProvenance(tr,c,r,x).",
      "lean": {
        "source": "lean/V0OSAP/ClusterB.lean",
        "status": "PROVED",
        "symbol": "V0OSAP.T157_strong_dle_characterization"
      },
      "lean_symbol": "V0OSAP.T157_strong_dle_characterization",
      "parity_status": "PASS",
      "proof_holes_permitted": false,
      "requires": [
        "T123",
        "T132"
      ],
      "statement_sha256": "4afc76d031b69016587e0ce65ce3e5d06a3ab9dc864828759ccd94c44889efd2",
      "theorem_id": "T157"
    },
    {
      "canonical_name": "live_residual_persistence_under_noninterfering_dle",
      "claim_class": "CONDITIONAL_THEOREM_TARGET",
      "conditional": true,
      "coq": {
        "source": "coq/theories/ClusterB.v",
        "status": "PROVED",
        "symbol": "T158_live_residual_persistence_under_noninterfering_dle"
      },
      "coq_symbol": "T158_live_residual_persistence_under_noninterfering_dle",
      "formal_signature": "LiveResidual(R0,q) and NonInterferingDLE(tr,q) and Apply(tr,R0)=R1 imply LiveResidual(R1,q).",
      "lean": {
        "source": "lean/V0OSAP/ClusterB.lean",
        "status": "PROVED",
        "symbol": "V0OSAP.T158_live_residual_persistence_under_noninterfering_dle"
      },
      "lean_symbol": "V0OSAP.T158_live_residual_persistence_under_noninterfering_dle",
      "parity_status": "PASS",
      "proof_holes_permitted": false,
      "requires": [
        "T124",
        "T132",
        "T139",
        "T162"
      ],
      "statement_sha256": "1188ecbe6b4e53ebd061be7350c49aa1d06feb4c9cd270f992ec95e0e170449f",
      "theorem_id": "T158"
    },
    {
      "canonical_name": "residual_type_separation",
      "claim_class": "THEOREM_TARGET",
      "conditional": false,
      "coq": {
        "source": "coq/theories/ClusterB.v",
        "status": "PROVED",
        "symbol": "T159_residual_type_separation"
      },
      "coq_symbol": "T159_residual_type_separation",
      "formal_signature": "ResidualType(q1) != ResidualType(q2) and not AdmissibleTranslation(q1,q2) imply not Interchangeable(q1,q2).",
      "lean": {
        "source": "lean/V0OSAP/ClusterB.lean",
        "status": "PROVED",
        "symbol": "V0OSAP.T159_residual_type_separation"
      },
      "lean_symbol": "V0OSAP.T159_residual_type_separation",
      "parity_status": "PASS",
      "proof_holes_permitted": false,
      "requires": [
        "T131",
        "T139"
      ],
      "statement_sha256": "19478447c22ed4202b7a6c765bf49f019846f209e310a7e18452795d0c46201d",
      "theorem_id": "T159"
    },
    {
      "canonical_name": "model_pair_noneliminability_witness",
      "claim_class": "CONDITIONAL_THEOREM_TARGET",
      "conditional": true,
      "coq": {
        "source": "coq/theories/ClusterB.v",
        "status": "PROVED",
        "symbol": "T160_model_pair_noneliminability_witness"
      },
      "coq_symbol": "T160_model_pair_noneliminability_witness",
      "formal_signature": "AdmissibleModelPair(M1,M2,S) and AgreeOn(M1,M2,S) and LiveResidual(M1,q) != LiveResidual(M2,q) imply NonEliminableFrom(q,S).",
      "lean": {
        "source": "lean/V0OSAP/ClusterB.lean",
        "status": "PROVED",
        "symbol": "V0OSAP.T160_model_pair_noneliminability_witness"
      },
      "lean_symbol": "V0OSAP.T160_model_pair_noneliminability_witness",
      "parity_status": "PASS",
      "proof_holes_permitted": false,
      "requires": [
        "T134",
        "T135",
        "T140",
        "T142",
        "T159"
      ],
      "statement_sha256": "7f78c6738c09425a3aaea7560ce5c21aca1bed9341155de64abb7540d0220f37",
      "theorem_id": "T160"
    },
    {
      "canonical_name": "minimal_single_residual_obstruction",
      "claim_class": "COROLLARY_TARGET",
      "conditional": false,
      "coq": {
        "source": "coq/theories/ClusterB.v",
        "status": "PROVED",
        "symbol": "T161_minimal_single_residual_obstruction"
      },
      "coq_symbol": "T161_minimal_single_residual_obstruction",
      "formal_signature": "DeclaredResidual(q) and LiveResidual(R,q) imply MinimalObstructionWitness(q,RawRelativeV0(R)).",
      "lean": {
        "source": "lean/V0OSAP/ClusterB.lean",
        "status": "PROVED",
        "symbol": "V0OSAP.T161_minimal_single_residual_obstruction"
      },
      "lean_symbol": "V0OSAP.T161_minimal_single_residual_obstruction",
      "parity_status": "PASS",
      "proof_holes_permitted": false,
      "requires": [
        "T134"
      ],
      "statement_sha256": "2fcb4a46f4f67bfc71b33f01f8f29d4c39f0b1491c4a620387c50da866c6663e",
      "theorem_id": "T161"
    },
    {
      "canonical_name": "historical_live_token_nonconversion",
      "claim_class": "THEOREM_TARGET",
      "conditional": false,
      "coq": {
        "source": "coq/theories/ClusterB.v",
        "status": "PROVED",
        "symbol": "T162_historical_live_token_nonconversion"
      },
      "coq_symbol": "T162_historical_live_token_nonconversion",
      "formal_signature": "HistoricalToken(t) and not FreshActivation(t,t2) imply not CurrentLiveGuardToken(t2).",
      "lean": {
        "source": "lean/V0OSAP/ClusterB.lean",
        "status": "PROVED",
        "symbol": "V0OSAP.T162_historical_live_token_nonconversion"
      },
      "lean_symbol": "V0OSAP.T162_historical_live_token_nonconversion",
      "parity_status": "PASS",
      "proof_holes_permitted": false,
      "requires": [
        "T133",
        "T139"
      ],
      "statement_sha256": "bd9fcaae0841f163733ce3444cfd23407e82de181ffb745b4e434cc00d9bcf4b",
      "theorem_id": "T162"
    }
  ],
  "version": "0.1"
}
